{
  "schemaVersion": 1,
  "projectId": "ium-lernwerk",
  "asOf": "2026-09-03",
  "requirementIds": [
    "V2-REQ-LXF-001"
  ],
  "records": [
    {
      "artifactId": "CLAIM-LP-001",
      "artifactKind": "claim",
      "artifactRef": "docs/research/phase-0/claim-ledger.json#CLAIM-LP-001",
      "decision": "adapt",
      "rationale": "Der IBBW-Rahmen trägt die Trennung von Tiefenstruktur und Methodenlabel. Für V2 müssen der angenommene Wirkpfad über kognitive Aktivierung, konstruktive Unterstützung und Klassenführung, die IuM-spezifische Übertragung sowie beobachtbare Kriterien ausdrücklich ergänzt werden; ein domänenspezifischer Wirksamkeitsnachweis liegt nicht vor.",
      "requirementIds": [
        "V2-REQ-LXF-001"
      ],
      "evidence": [
        "docs/research/phase-0/source-register.json#SRC-LP-IBBW-WU",
        "docs/research/phase-0/curated/03-lernpsychologie-unterricht.md"
      ],
      "successorTaskId": "LXF02"
    },
    {
      "artifactId": "CLAIM-LP-002",
      "artifactKind": "claim",
      "artifactRef": "docs/research/phase-0/claim-ledger.json#CLAIM-LP-002",
      "decision": "adapt",
      "rationale": "Die Evidenz zu Vorwissen ist stark und die lokale Aktivierung bleibt tragfähig. V2 muss jedoch Vorwissen, einzelne Fehlantwort und stabiles Fehlkonzept auseinanderhalten, die starke Kontextvariation abbilden und festlegen, welche sichtbare Lernhandlung welche Anschlussentscheidung rechtfertigt.",
      "requirementIds": [
        "V2-REQ-LXF-001"
      ],
      "evidence": [
        "docs/research/phase-0/source-register.json#SRC-LP-PRIOR-2022",
        "docs/research/phase-0/curated/03-lernpsychologie-unterricht.md"
      ],
      "successorTaskId": "LXF02"
    },
    {
      "artifactId": "CLAIM-LP-003",
      "artifactKind": "claim",
      "artifactRef": "docs/research/phase-0/claim-ledger.json#CLAIM-LP-003",
      "decision": "adapt",
      "rationale": "Cognitive Load Theory begründet die gemeinsame Betrachtung von Aufgabe, Vorwissen und Darstellung. Der V2-Vertrag muss theoretischen Mechanismus, konkrete Designmanipulation, Prozessindikator und Lernoutcome trennen und Expertise, Fachaufgabe sowie Analog-/Digitalwahl als Randbedingungen ausweisen.",
      "requirementIds": [
        "V2-REQ-LXF-001"
      ],
      "evidence": [
        "docs/research/phase-0/source-register.json#SRC-LP-CLT-2020",
        "docs/research/phase-0/curated/03-lernpsychologie-unterricht.md"
      ],
      "successorTaskId": "LXF02"
    },
    {
      "artifactId": "CLAIM-LP-004",
      "artifactKind": "claim",
      "artifactRef": "docs/research/phase-0/claim-ledger.json#CLAIM-LP-004",
      "decision": "adapt",
      "rationale": "Aktiv verarbeitete Worked Examples bleiben ein starker Kandidat. Die vorliegende Mathematikevidenz trägt aber weder passive Betrachtung noch ein universelles Fadingrezept; V2 muss Domäne, Vorwissen, Verarbeitungsauftrag, Rücknahmekriterium und Transferprüfung spezifizieren.",
      "requirementIds": [
        "V2-REQ-LXF-001"
      ],
      "evidence": [
        "docs/research/phase-0/source-register.json#SRC-LP-WORKED-2023",
        "docs/research/phase-0/curated/03-lernpsychologie-unterricht.md"
      ],
      "successorTaskId": "LXF02"
    },
    {
      "artifactId": "CLAIM-LP-005",
      "artifactKind": "claim",
      "artifactRef": "docs/research/phase-0/claim-ledger.json#CLAIM-LP-005",
      "decision": "adapt",
      "rationale": "Selbsterklärung ist im Mittel lernförderlich, aber nicht als generischer Zusatzprompt. V2 benötigt einen fachlichen Mechanismus je Prompt, eine Begrenzung der Zusatzlast, definierte Antwortnutzung und eine Prüfung, ob Begründung, Vorhersage oder Reparatur tatsächlich verbessert wird.",
      "requirementIds": [
        "V2-REQ-LXF-001"
      ],
      "evidence": [
        "docs/research/phase-0/source-register.json#SRC-LP-SELFEXPLAIN-2018",
        "docs/research/phase-0/curated/03-lernpsychologie-unterricht.md"
      ],
      "successorTaskId": "LXF02"
    },
    {
      "artifactId": "CLAIM-LP-006",
      "artifactKind": "claim",
      "artifactRef": "docs/research/phase-0/claim-ledger.json#CLAIM-LP-006",
      "decision": "adapt",
      "rationale": "Computerbasiertes Scaffolding ist als Unterstützungsrichtung tragfähig. Die heterogene Evidenz begründet keine bestimmte Adaptions- oder Fadinglogik; V2 muss fachliche Hürde, erhaltene Kernhandlung, sichtbares Bewältigungskriterium und sicheren Rückfall explizit machen.",
      "requirementIds": [
        "V2-REQ-LXF-001"
      ],
      "evidence": [
        "docs/research/phase-0/source-register.json#SRC-LP-SCAFFOLD-2017",
        "docs/research/phase-0/curated/03-lernpsychologie-unterricht.md"
      ],
      "successorTaskId": "LXF02"
    },
    {
      "artifactId": "CLAIM-LP-007",
      "artifactKind": "claim",
      "artifactRef": "docs/research/phase-0/claim-ledger.json#CLAIM-LP-007",
      "decision": "adapt",
      "rationale": "Aktiver Abruf bleibt belastbar, darf aber nicht mit Wiedersehen oder einer Quizoberfläche gleichgesetzt werden. V2 muss Abrufhandlung, Vergleichsbedingung, Wiederholung, Feedback, Testpassung und fachliches Erfolgskriterium je Einsatz benennen.",
      "requirementIds": [
        "V2-REQ-LXF-001"
      ],
      "evidence": [
        "docs/research/phase-0/source-register.json#SRC-LP-QUIZZING-2021",
        "docs/research/phase-0/curated/03-lernpsychologie-unterricht.md"
      ],
      "successorTaskId": "LXF02"
    },
    {
      "artifactId": "CLAIM-LP-008",
      "artifactKind": "claim",
      "artifactRef": "docs/research/phase-0/claim-ledger.json#CLAIM-LP-008",
      "decision": "adapt",
      "rationale": "Verteilte Wiederaufnahme ist für verzögertes Behalten plausibel. Die Evidenz legt weder den Abstand noch die Lernhandlung für komplexe IuM-Inhalte und 10- bis 13-Jährige fest; V2 muss Wiederaufnahmefenster, Variation, Messzeitpunkt und curriculare Anschlussstelle definieren.",
      "requirementIds": [
        "V2-REQ-LXF-001"
      ],
      "evidence": [
        "docs/research/phase-0/source-register.json#SRC-LP-SPACING-2025",
        "docs/research/phase-0/curated/03-lernpsychologie-unterricht.md"
      ],
      "successorTaskId": "LXF02"
    },
    {
      "artifactId": "CLAIM-LP-009",
      "artifactKind": "claim",
      "artifactRef": "docs/research/phase-0/claim-ledger.json#CLAIM-LP-009",
      "decision": "adapt",
      "rationale": "Retrieval Practice kann Transfer unterstützen, erzeugt ihn aber nicht automatisch. V2 muss Transferdimension, veränderten Kontext, erhaltenes Prinzip, notwendigen initialen Abruf und getrennte Kriterien für unmittelbare Anwendung, Behalten und Transfer festschreiben.",
      "requirementIds": [
        "V2-REQ-LXF-001"
      ],
      "evidence": [
        "docs/research/phase-0/source-register.json#SRC-LP-TRANSFER-2018",
        "docs/research/phase-0/curated/03-lernpsychologie-unterricht.md"
      ],
      "successorTaskId": "LXF02"
    },
    {
      "artifactId": "CLAIM-LP-010",
      "artifactKind": "claim",
      "artifactRef": "docs/research/phase-0/claim-ledger.json#CLAIM-LP-010",
      "decision": "adapt",
      "rationale": "Feedback ist relevant, die Effekte sind jedoch extrem heterogen und teilweise negativ. V2 muss Informationsgehalt, Bezug auf Produkt oder Strategie, Timing, Sicherheitsgrenze, Anschlussnutzung und beobachtbares Revisionskriterium methodenspezifisch definieren.",
      "requirementIds": [
        "V2-REQ-LXF-001"
      ],
      "evidence": [
        "docs/research/phase-0/source-register.json#SRC-LP-FEEDBACK-2020",
        "docs/research/phase-0/curated/03-lernpsychologie-unterricht.md"
      ],
      "successorTaskId": "LXF02"
    },
    {
      "artifactId": "CLAIM-LP-011",
      "artifactKind": "claim",
      "artifactRef": "docs/research/phase-0/claim-ledger.json#CLAIM-LP-011",
      "decision": "adapt",
      "rationale": "Die Vereinbarkeit von Autonomieunterstützung und Struktur ist ein wichtiges Korrektiv. Die überwiegend korrelative, hoch heterogene Evidenz trägt keine pauschale Synergie oder Leistungswirkung; V2 muss echte Wahl, notwendige Leitplanke, Alterskontext und getrennte Motivations- und Lernkriterien ausweisen.",
      "requirementIds": [
        "V2-REQ-LXF-001"
      ],
      "evidence": [
        "docs/research/phase-0/source-register.json#SRC-LP-AUTONOMY-2025",
        "docs/research/phase-0/curated/03-lernpsychologie-unterricht.md"
      ],
      "successorTaskId": "LXF02"
    },
    {
      "artifactId": "CLAIM-LP-012",
      "artifactKind": "claim",
      "artifactRef": "docs/research/phase-0/claim-ledger.json#CLAIM-LP-012",
      "decision": "adapt",
      "rationale": "Vorbereitete Problemlösung vor Instruktion bleibt unter Productive-Failure-Bedingungen interessant. Für jüngere Lernende kann die Gegenrichtung gelten; V2 muss Lösungsraum, Kontrastfälle, Vorläuferwissen, anschließende explizite Instruktion und ein eigenes Überforderungsgate für Klasse 5 festlegen.",
      "requirementIds": [
        "V2-REQ-LXF-001"
      ],
      "evidence": [
        "docs/research/phase-0/source-register.json#SRC-LP-PF-2021",
        "docs/research/phase-0/curated/03-lernpsychologie-unterricht.md"
      ],
      "successorTaskId": "LXF02"
    },
    {
      "artifactId": "CLAIM-LP-013",
      "artifactKind": "claim",
      "artifactRef": "docs/research/phase-0/claim-ledger.json#CLAIM-LP-013",
      "decision": "adapt",
      "rationale": "Explizite Selbstregulationshandlungen passen zur Zielgruppe, doch die Evidenz ist älter, nicht randomisiert, nicht digital und überwiegend auf unmittelbare Posttests begrenzt. V2 muss Planen, Überwachen, Prüfen und Revidieren als konkrete Fachhandlungen statt als Personeneigenschaft operationalisieren und gesondert erproben.",
      "requirementIds": [
        "V2-REQ-LXF-001"
      ],
      "evidence": [
        "docs/research/phase-0/source-register.json#SRC-LP-SRL-2008",